<?xml version="1.0" encoding="UTF-8"?>
<!DOCTYPE world SYSTEM "gameworld.dtd">
<world width="32" height="16" offsetX="128" offsetY="128">
    <htunnels>
        <ht x="15" y="12" width="7" id="a_up"/>
        <ht x="10" y="1" width="12" id="a_down"/>
        <ht x="10" y="11" width="11" id="b_up"/>
        <ht x="11" y="2" width="10" id="b_down"/>
        <ht x="11" y="10" width="9" id="c_up"/>
        <ht x="12" y="3" width="8" id="c_down"/>
        <ht x="12" y="9" width="7" id="d_up"/>
        <ht x="13" y="4" width="6" id="d_down"/>
        <ht x="13" y="8" width="5" id="e_up"/>
        <ht x="14" y="5" width="4" id="e_down"/>
        <ht x="14" y="7" width="3" id="f_up"/>
        <ht x="15" y="6" width="2" id="f_down"/>
    </htunnels>
    <interconnections>
        <ic x="21" from="a_up" to="a_down"/>
        <ic x="20" from="b_up" to="b_down"/>
        <ic x="19" from="c_up" to="c_down"/>
        <ic x="18" from="d_up" to="d_down"/>
        <ic x="17" from="e_up" to="e_down"/>
        <ic x="16" from="f_up" to="f_down"/>
        <ic x="10" from="b_up" to="a_down"/>
        <ic x="11" from="c_up" to="b_down"/>
        <ic x="12" from="d_up" to="c_down"/>
        <ic x="13" from="e_up" to="d_down"/>
        <ic x="14" from="f_up" to="e_down"/>
    </interconnections>
    <entrances>
        <entrance x="15" y="13" to="a_up" id="center"/>
    </entrances>
</world>